business_name,community_board,council_district,bin,bbl,census_tract,latitude,longitude
SANJAY'S VARIETY STORE INC.,412.0,23.0,4222128.0,4104460036.0,482.0,40.71208922,-73.76933251
"FAMILY CARE REFERRAL, LLC",105.0,4.0,1034313.0,1012620001.0,96.0,40.75747836,-73.98217597
"King Studz Construction, LLC",305.0,42.0,3097199.0,3043190012.0,1104.0,40.65853146,-73.89385238
ALL AMERICA APPLIANCE SERVICE LLC,311.0,47.0,3169881.0,3064650072.0,282.0,40.60024526,-74.00635228
MEDI CASA INC,408.0,24.0,4143657.0,4066390036.0,22002.0,40.71563933,-73.81564167
